filename,relevant_text_segment,assigned_subject
11220308_Resumen_Abstract.pdf,"Contenido: RESUMEN: Describa los principales puntos que se abordarán en la propuesta: objetivos, metodología y resultados esperados. La extensión máxima de esta sección es de 1 página tamaño carta (utilizar formato tamaño carta, fuente Verdana tamaño 10 o similar). Evite incluir en esta sección información que le identifique, tales como: nombres, iniciales, institución de pertenencia o patrocinante, links u otros antecedentes. La propuesta tiene por objeto contribuir al conocimiento empírico de la trata de personas mediante la detección de casos en los que el involucramiento de la persona extranjera en un delito de tráfico de drogas es consecuencia directa de prácticas explotadoras típicas de la trata, tales como el engaño o la coacción (criminal exploitation). A partir de ahí, la propuesta busca analizar los factores que inciden en la invisibilización del fenómeno y los efectos que produce en la persona afectada, especialmente a partir de la doble victimización que experimenta cuando es privada de libertad. Considerando que el proyecto aborda un fenómeno criminal no explorado en Chile, la estrategia metodológica que se empleará es de carácter cualitativo y se orienta por el diseño sistemático de la Teoría Fundamentada (Grounded Theory). El trabajo de campo se realizará principalmente en las cárceles de las regiones de Arica y Parinacota, Tarapacá y Antofagasta, y la muestra estará conformada por personas extranjeras privadas de libertad imputadas y condenadas por un delito de tráfico de drogas, por operadores del sistema penal y por otros actores relacionados. Las técnicas de recogida de información que se utilizarán son el análisis documental, el cuestionario, la observación, la entrevista semiestructurada y la entrevista en profundidad. A partir de los hallazgos, se espera un impacto en tres direcciones. En primer lugar, en tanto tiene por objeto principal revelar la existencia de casos de explotación criminal, pretende visibilizar el fenómeno nutriendo de información tanto a los reportes nacionales e internacionales que se elaboran al respecto, cuanto a los encargados de diseñar y ejecutar políticas públicas que tengan por objeto proteger a víctimas de trata. En segundo lugar, la propuesta busca contribuir al desempeño de los operadores del sistema penal, proporcionando datos que sirvan tanto para la persecución de las conductas relacionadas (tráfico de drogas y trata), el diseño de estrategias de defensa, la administración penitenciaria, y el juzgamiento de los casos. En tercer lugar, aspira a contribuir en el cumplimiento de las obligaciones contraídas por el Estado de Chile a partir de la reciente ratificación del Protocolo de 2014 que complementa el Convenio sobre Trabajo Forzoso de 1930 (19 de enero del 2021), levantando información útil de cara a la formulación de una futura propuesta de lege ferenda relacionada con la trata de personas con fines de explotación criminal. En términos generales, la propuesta desarrolla el problema que gira en torno al impacto que tiene el castigo de posibles víctimas de trata en relación con el paradigma político-criminal de las 3P (prosecution, protection, prevention). Para ello, en una primera instancia, explica los alcances de dicho paradigma en relación con la necesidad ...",Derecho Penal
11220370_Resumen_Abstract.pdf,"Contenido: RESUMEN: En la actualidad, diversas decisiones fundamentales para la vida de las personas son adoptadas total o parcialmente con tecnologías digitales que suponen procesos automatizados de decisión basados en la recolección, gestión y análisis de datos. En el ámbito público, existen múltiples programas y beneficios sociales que hoy en día son gestionados y provistos a través de procesos automatizados de decisión con poca o casi nula participación humana, configurando lo que se conoce como el “Estado de Bienestar Digital”. En el ámbito privado, estos procesos han impactado significativamente en el campo laboral, donde una gran cantidad de actividades de control, instrucción y evaluación hoy en día son administradas por tecnologías digitales que reemplazan las relaciones humanas que usualmente configuran la actividad laboral, como se manifiesta en las denominadas “Plataformas Digitales de Trabajo”. Si bien el uso de algoritmos ha tenido efectos positivos en distintos ámbitos, recientemente se han levantado varias críticas, entre ellas, cuestiones relativas a la seguridad de los datos, la privacidad de las personas, el impacto en procesos democráticos o la discriminación contra grupos desaventajados. Este proyecto aborda la relación entre procesos automatizados de decisión que utilizan tecnologías digitales y el principio de igualdad y no discriminación. En concreto, pretende comprender el fenómeno de la discriminación algorítmica y sus diferentes formas, con el objeto de proponer, en el marco del ordenamiento jurídico chileno, las respuestas institucionales adecuadas, esto es, las interpretaciones, adecuaciones o modificaciones que se deberían realizar para abordar las formas de discriminación algorítmica. Para ello, el proyecto utiliza dos casos de estudio, el “Estado de Bienestar Digital” y las “Plataformas Digitales de Trabajo”, que comprenden ámbitos públicos y privados en que se ha observado una creciente utilización de procesos automatizados de decisión, y que además están afectados por lo que se denomina como “opacidad algorítmica”. El proyecto busca ofrecer una respuesta a las siguientes preguntas de investigación: (1) ¿qué formas de discriminación algorítmica se observan en los procesos automatizados de decisión que se aplican en los sistemas de protección y asistencia social y en las denominadas “Plataformas Digitales de Trabajo”?; (2) ¿cómo se han abordado estas formas de discriminación algorítmica en sistemas jurídicos comparados, considerando los desafíos que plantea la opacidad algorítmica?; (3) ¿qué lugar corresponde a la prohibición de discriminación indirecta en la lucha contra la discriminación algorítmica? (4) ¿qué interpretaciones, adecuaciones o modificaciones se pueden proponer al ordenamiento jurídico chileno para abordar estas formas de discriminación algorítmica? Para responder estas preguntas, el proyecto pretende analizar las diversas formas de discriminación algorítmica que tienen lugar en los casos de estudio seleccionados; clasificar, con un enfoque crítico, las formas de discriminación algorítmica de acuerdo con las categorías disponibles en el derecho de la antidiscriminación, con especial consideración a la prohibición de discriminación indirecta; y, finalmente, evaluar las posibles respuestas institucionales, ya sea proponiendo modificaciones o adecuaciones del marco regulatorio existente, que puede ofrecer el ordenamiento jurídico chileno ante las diversas formas de discriminación algorítmica. En este contexto, el resultado esperado de la investigación es una ...",Derecho del Trabajo y la Seguridad Social
11220386_Resumen_Abstract.pdf,"Contenido: RESUMEN: Describa los principales puntos que se abordarán en la propuesta: objetivos, metodología y resultados esperados. La extensión máxima de esta sección es de 1 página tamaño carta (utilizar formato tamaño carta, fuente Verdana tamaño 10 o similar). Evite incluir en esta sección información que le identifique, tales como: nombres, iniciales, institución de pertenencia o patrocinante, links u otros antecedentes. Objetivos e Hipótesis Existe relativamente poca investigación enfocada en examinar la relación entre los procedimientos de toma de decisiones en los tribunales que controlan la constitucionalidad de las leyes (tales como el Tribunal Constitucional chileno) y el grado de consenso entre sus jueces. Este vacío dificulta la realización de análisis acerca de si los jueces efectivamente deliberan entre ellos, basando sus sentencias en un robusto intercambio de razones. Por tanto, este vacío priva a las personas encargadas de diseñar e implementar un sistema de justicia constitucional —tales como nuestros futuros convencionales constituyentes—, de insumos valiosos para evaluar (y por ende, eventualmente mejorar) tal sistema. En consecuencia, el objetivo principal de esta investigación es examinar detalladamente los procedimientos decisorios de varias cortes supremas y tribunales constitucionales alrededor del mundo (en adelante, “TC”), para así observar su influencia en el grado de consenso judicial. Esta investigación incluye al TC chileno. La hipótesis a confirmar o refutar es que los procedimientos decisorios de los TC a analizar influyen sustancialmente en los grados de consenso entre sus jueces. Para realizar esta investigación, se requerirá recopilar datos sobre los procedimientos decisorios de los TC a analizar y sobre el grado de consenso judicial en sus sentencias dictadas durante los últimos 10 años. Además, se requerirá codificar los datos y analizarlos desde una perspectiva tanto cuantitativa como cualitativa. Los resultados de esta investigación y los datos utilizados se divulgarán al público general —incluídos nuestros futuros convencionales constituyentes—, por medio de una página web basada en el Comparative Constitutions Project (s.f.). También se creará una estructura institucional para mantener la página web y los datos vigentes a través del tiempo. Metodología Para realizar esta investigación, se utilizarán varios métodos y técnicas de carácter cuantitativo, cualitativo y comparativo. Este enfoque mixto permitirá observar asociaciones entre los procedimientos decisorios de los TC a analizar (variables independientes) y el grado de consenso judicial (variable dependiente). Además, este enfoque mixto permitirá indagar acerca de los mecanismos causales que afectan el grado de consenso judicial, así como también analizar si dicho consenso se basa en una efectiva deliberación. Estos métodos y técnicas son siete. (i) Método jurídico comparado: se utilizará para generar las variables a analizar. (ii) Selección aleatoria simple: se utilizará para obtener muestras aleatorias de sentencias dictadas por los TC a analizar en los últimos 10 años. (iii) Análisis textual: se utilizará para recopilar datos sobre las variables en la literatura académica y en bases de datos. (iv) Cuestionarios con preguntas de selección múltiple: se utilizarán para recopilar datos que no puedan obtenerse via análisis textual. Los cuestionarios se dirigirán a jueces, ex jueces, o académicos de derecho constitucional ...",Derecho Político y Constitucional
11220439_Resumen_Abstract.pdf,"Contenido: RESUMEN: Describa los principales puntos que se abordarán en la propuesta: objetivos, metodología y resultados esperados. La extensión máxima de esta sección es de 1 página tamaño carta (utilizar formato tamaño carta, fuente Verdana tamaño 10 o similar). Evite incluir en esta sección información que le identifique, tales como: nombres, iniciales, institución de pertenencia o patrocinante, links u otros antecedentes. Este proyecto busca revelar y problematizar la historia de las mujeres abogadas entre 1920 y 1990, en particular estudiando la forma en que se vincularon al ámbito político. Este grupo social ha sido escasamente considerado por la historiografía, la sociología y las ciencias jurídicas. Desde la disciplina de la historia del derecho y en diálogo con la sociología de las profesiones y la teoría de género, este proyecto busca comprender cómo la identidad profesional y la identidad de género de las mujeres abogadas definió su inserción en el ámbito público desde distintas veredas ideológicas. La investigación introduce el concepto de “abogadas-políticas”, entendiendo por ello al grupo de mujeres profesionales del derecho que tuvieron incidencia no solamente en el campo profesional, sino también en el campo político entendido de forma amplia (cargos públicos, movimientos sociales y participación de la esfera pública). El proyecto busca comprender cómo estas abogadas-políticas construyeron su identidad de género y movilizaron sus vínculos profesionales y su conocimiento jurídico para avanzar diversas causas políticas –feministas y no feministas, de izquierda, centro o derecha–, y qué nivel de incidencia tuvieron en estos distintos ámbitos. Los principales objetivos del proyecto son: 1) Identificar y caracterizar en términos sociales y políticos a las abogadas que intervinieron en el espacio público entre 1920 y 1990; 2) Identificar las redes que las unieron, las diferencias que las separaron, y los distintos grupos en que se articularon en torno a distintas ideologías políticas o causas de interés público; 3) Analizar las formas de actuación, las estrategias y los discursos que utilizaron las mujeres abogadas, y cómo estos cambiaron o se mantuvieron en el tiempo; 4) Evaluar el nivel de efectividad e influencia profesional y política de los distintos grupos de abogadas en función de su ideología política, y los factores que pueden explicar las diferencias en el logro de sus objetivos; 5) Comparar las acciones y los discursos de las abogadas-políticas con aquellos de los abogados hombres, y con otras mujeres profesionales y no profesionales, 6) Comparar la trayectoria de las abogadas-políticas chilenas con aquella de las mujeres abogadas a nivel internacional; 7) Evaluar el impacto jurídico, político, social y económico de las acciones y discursos de las abogadas-políticas en Chile a lo largo del siglo XX, y sus posibles implicancias para el siglo XXI. La hipótesis preliminar que plantea el proyecto es que si bien las abogadas-políticas utilizaron el derecho como una herramienta que les otorgó liderazgo en distintas esferas políticas, incluido el movimiento feminista, las mujeres abogadas tuvieron dificultades en cuestionar la estructura masculina y patriarcal impuesta por su propia identidad profesional. Así, la efectividad de la acción política de las ...",Historia del Derecho
11220480_Resumen_Abstract.pdf,"Contenido: RESUMEN: La investigación que se propone persigue identificar, describir y sistematizar los usos le han dado los jueces y académicos chilenos a la idea del poder constituyente a partir de 1973. Luego, la investigación examinará la teoría clásica del poder constituyente (basada en los trabajos de Sieyès y de Schmitt) y las teorías modernas que han buscado corregir dicha teoría clásica agregando elementos adicionales. Así, la propuesta también busca dar cuenta del modo como los diversos usos pueden ser consistentes con una u otra teoría. La propuesta no intenta discutir normativamente la idea del poder constituyente, ni realizar un examen abstracto y descontextualizado de la misma. En cambio, el proyecto persigue describir el modo como los actores específicos (jueces y académicos) utilizan dicha idea, y con qué objetivos. En otras palabras, comprender las acciones que académicos y jueces intentan justificar utilizando la idea del poder constituyente. Propongo una sistematización inicial de dichos usos, que se irá completando a medida que la investigación avance. También, agregaré subtipos de casos. Comenzaré tomando algunos casos extranjeros para identificar distintas posibilidades de uso (Francia, Colombia, Bolivia, Venezuela y Ecuador), y luego examinaré la experiencia judicial y doctrinaria chilena, a partir de los debates sobre la Constitución de 1980 hasta los debates inmediatamente posteriores a la dictación de la nueva constitución que el proceso constituyente en curso persigue implementar. A modo tentativo, y respecto de los jueces, haré una distinción inicial. En un primer grupo, se encuentran aquellos usos que persiguen habilitar a los órganos constituidos para restringir el poder político. Así, por ejemplo, existen casos de jueces que invocan la teoría del poder constituyente para justificar su atribución de declarar la inconstitucionalidad de un acto administrativo, o su facultad para revisar un proyecto de reforma constitucional. En un segundo grupo, se encuentran aquellos usos que persigan restringir y delimitar las competencias de dichos órganos para expandir o permitir el ejercicio del poder político. Ello ocurre, por ejemplo, en casos donde un juez utiliza la idea del poder constituyente para permitir que una asamblea constituyente no siga reglas procedimentales preestablecidos o aquellos en que un juez argumenta que, en tanto órgano constituido, carece de potestades para evaluar la constitucionalidad de una reforma. Respecto de los académicos, y a modo tentativo, distinguiré los usos que consistan en (i) evaluar la legitimidad de una constitución vigente o de un proceso constituyente en curso; (ii) argumentar que un proceso constituyente futuro debe restringirse de acuerdo a principios inherente al poder constituyente o utilizando una perspectiva post-soberana; y (iii) en argumentar a favor de la preservación de ciertas disposiciones constitucionales vigentes o en promover la eliminación de ciertas normas o principios que parecen incompatibles con una manera evolutiva de entender el poder constituyente. Una vez identificados y sistematizados los usos, el proyecto de investigación propone identificar y describir los argumentos asociados a la idea del poder constituyente que se utilizan en cada uno de los usos, y ver si ellos son compatibles con la teoría clásica o si ...",Derecho Político y Constitucional
11220494_Resumen_Abstract.pdf,"ía no existe un estudio a nivel de derecho internacional y comparado que determine cuál es, en materia jurídica, el valor de estas prácticas. Esta propuesta vislumbra a determinar cuáles de estas prácticas constituyen realmente un medio para garantizar el acceso a la justicia a los consumidores. 2. OBJETIVOS: a) Objetivo general: Este estudio tiene por objetivo principal examinar cómo el Estado de Chile cumplimentaría de mejor manera las herramientas que tiene previstas para dar cumplimiento a la obligación de respeto y promoción del derecho fundamental al acceso a la justicia de los consumidores, considerando el uso de la Inteligencia Artificial en los mecanismos extrajudiciales de resolución de conflicto online (ODR), a la luz del derecho comparado y de las prácticas introducidas por estos sistemas de resolución de conflictos. b) Objetivos específicos: b.1) Revisar los alcances teóricos y debates referidos al “acceso a la justicia”, para plantear un concepto de derecho a la autocomposición del conflicto para los consumidores; b.2) sistematizar los estándares que dotan de contenido normativo al derecho fundamental al acceso a la justicia de los consumidores en el marco del derecho internacional privado y el derecho comparado en los reglamentos que establecen principios estandarizados para el uso de ODRs y en los cuerpos legislativos vigentes sobre la materia; b.3) estudiar cómo las prácticas de los ODR, que se apoyan en el uso de la Inteligencia Artificial, han recepcionado el derecho fundamental al acceso a la justicia de los consumidores consideran la necesidad de garantizar el debido proceso y la seguridad jurídica. 3. METODOLOGÍA Y RESULTADOS ESPERADOS: A partir de un paradigma interpretativista, se emplearán métodos y técnicas propias de la investigación jurídica. Primero, el método estrictamente jurídico del derecho comparado, que tendrá por objeto tanto de principios de Soft law en derecho internacional privado relativos a la creación de mecanismos de ejecutoriedad de acuerdos internacionales y a la creación de estándares para la operatividad de las plataformas ODR a nivel transnacional; normatividad vigente en la Unión Europea y Brasil relativos a la operatividad de los ODR, y proyectos de ley en curso en Chile. En segundo lugar, se utilizará el método jurídico strictu sensu, consistente en la articulación de la dogmática y la casuística como dos etapas sucesivas destinadas a la construcción de teorías jurídicas particulares con base en técnicas de interpretación y argumentación jurídica tanto sobre fuentes primarias como secundarias, lo cual incluye la crítica doctrinal y el análisis de las categorías descritas a partir del análisis de derecho comparado. Esto permitirá hacer un registro y revisión crítica de las prácticas de los ODR para fomentar el debido proceso (1); y un registro y revisión crítica de las prácticas de los ODR para fomentar la seguridad jurídica (2). La investigación que ahora se propone pretende impactar con nuevo conocimiento que contribuya a fortalecer la futura regulación en materia de métodos alternativos de solución de conflictos en Chile, a elevar los estándares de protección al consumidor y a alcanzar mayor seguridad jurídica para los proveedores, incluyendo nuevas ...",Derecho Internacional
11220600_Resumen_Abstract.pdf,"Contenido: RESUMEN: Título: “La justicia en vitrina. Un estudio dogmático sobre los riesgos de la publicidad judicial y su adecuada limitación” El proyecto se propone contribuir al desarrollo dogmático de los límites del principio de publicidad judicial en los procesos chilenos. Este principio goza de un amplio reconocimiento en el derecho nacional. Está consagrado en la Constitución (como elemento del debido proceso del artículo 19 N° 3), en Tratados Internacionales, en el Código Orgánico de Tribunales (artículo 9) y en las leyes procedimentales. Este reconocimiento, sin embargo, no ha sido acompañado por una regulación coherente de sus límites frente a intereses legítimos de confidencialidad: No hay un catálogo general de excepciones, ni claridad sobre las facultades judiciales para limitar la publicidad judicial en el caso concreto. Incluso las normas especiales que sí consideran excepciones (p. ej. el artículo 289 del Código Procesal Penal) dejan preguntas abiertas respecto a su aplicación al caso concreto. No está explorada, de forma sistemática, la pregunta por los intereses jurídicamente protegidos que justifican su limitación (honra, privacidad, datos personales, secretos empresariales, profesionales etc.), ni la variedad de medidas que permiten a un tribunal restringir la publicidad para resguardarlos, ni el método para decidir sobre su aplicación. El proyecto se propone llenar este vacío y aportar al desarrollo de una regulación de los límites del principio de publicidad que, sin subvertir su función de control, asegure la protección de legítimos intereses de confidencialidad con medidas adecuadas a las particularidades de cada caso. El punto de partida es distinguir distintos tipos de publicidad judicial: por un lado, la publicidad externa, dentro de la cual se puede identificar la publicidad de sala, la publicidad de expediente y la publicidad mediática y, por el otro lado, la publicidad interna, como derecho de las partes a acceder a los contenidos del proceso. La relevancia de la propuesta radica en que la práctica refleja problemas propios de una publicidad judicial sin régimen claro de protección de intereses contrapuestos: en materia civil, las solicitudes prejudiciales de información se enfrentan a objeciones de confidencialidad sin que los tribunales tengan herramientas para encontrar soluciones ponderadas; la Ley de Tramitación Electrónica otorga acceso a toda persona la carpeta electrónica, sin normar excepciones ni facultades judiciales para regularlo; y, en materia penal, la cobertura mediática de recientes juicios de alta connotación pública muestran la insuficiencia de las normas vigentes de protección contra efectos adversos de la publicidad. A ello se han agregado las interrogantes sobre el acceso de la ciudadanía a audiencias telemáticas en tiempo de pandemia. Estos desarrollos hacen necesario un estudio dogmático que entregue a los actores del sistema herramientas para un adecuado equilibrio entre la publicidad judicial e intereses legítimos de confidencialidad. La hipótesis es que el amplio reconocimiento del principio de la publicidad judicial en Chile dejó pendiente el desarrollo de las reglas que permiten limitarlo para proteger legítimos intereses contrapuestos. Una adecuada limitación exige reconocer los intereses legítimos de confidencialidad que justifican una restricción, identificar medidas de restricción apropiadas en el ...",Derecho Procesal
