filename,relevant_text_segment,assigned_subject
11231058_Resumen_Abstract.pdf,"Contenido: PERSPECTIVAS DE LA APLICACIÓN DE LAS OBSERVACIONES GENERALES DEL COMITÉ DEL PIDESC EN MATERIA DE DERECHO A LA SALUD RESUMEN: Las recientes sentencias sobre derechos sociales de nuestra Corte Suprema parecen estar adoptando la visión de que las políticas sociales pueden ser adjudicadas por los jueces directamente a partir de lo que señala la Constitución Política, sin necesidad de legislación de desarrollo. Para ello, el máximo tribunal está recurriendo a una de las técnicas más utilizadas por otros tribunales sudamericanos para adjudicar pretensiones prestacionales, cual es la cita, como fundamento del fallo o de la interpretación atribuida a una determinada disposición constitucional, de lo señalado en las Observaciones Generales (OO.GG.) del Comité de Derechos Económicos, Sociales y Culturales de la ONU (Comité DESC), encargado de interpretar las disposiciones del Pacto Internacional de Derechos Económicos, Sociales y Culturales. Dadas las particularidades de estos documentos, la presente investigación propone estudiar si es pertinente su utilización como elemento de argumentación en las sentencias de nuestra Corte Suprema que adjudican derechos sociales. Hasta ahora, nuestra Corte Suprema ha acudido a estos documentos para fundamentar decisiones en torno a algunos derechos sociales y nuevos derechos, como el acceso al agua y una interpretación extendida del derecho a la vida. En este contexto, esta investigación abordará el problema de su eventual utilización a propósito del derecho a la salud, por ser el más justiciado por nuestro máximo tribunal en los últimos tres años. La problemática que proponemos se deriva de que, a diferencia de otras técnicas para fundamentar la justiciabilidad de derechos sociales, dichas OO.GG. han desarrollado con cierto detalle el contenido de políticas que debiera caracterizar al cumplimiento de cada uno de los derechos consagrados en el PIDESC, avanzando incluso, en algunos casos, al reconocimiento de derechos que no están expresamente considerados en la letra de este tratado internacional (como, por ejemplo, el derecho al agua, en la O.G. nro 15; o el derecho a la vivienda, en la O.G. nro. 4o). Su utilización en la jurisprudencia de nuestro máximo tribunal, por tanto, podría incidir fuertemente en la interpretación constitucional o legal del derecho a la salud y en la forma de adjudicarlo; con evidentes consecuencias en la formulación interna de aquellas políticas y en la relación competencial entre los jueces y las autoridades representativas. Puesto que este fenómeno jurisprudencial también se produce en países que ya cuentan con constituciones de Estado social, se trata de un problema que mantendrá su interés incluso en el caso de que el proceso constituyente en curso desemboque en la aprobación de una nueva Constitución Política. Por eso, este proyecto se encauzará a través de la pregunta de investigación acerca de cuál es el valor jurídico de las OO.GG del Comité PIDESC en el sistema constitucional. Lo anterior con el objetivo de proponer herramientas jurídicas para la correcta interpretación y aplicación de estos documentos en el derecho interno, tanto en la actividad de adjudicación de nuestros tribunales como en la actividad de formulación de políticas sociales de salud; ...",Derecho Político y Constitucional
11231094_Resumen_Abstract.pdf,"Contenido: RESUMEN: Describa los principales puntos que se abordarán en la propuesta: objetivos, metodología y resultados esperados. La extensión máxima de esta sección es de 1 página tamaño carta (utilizar formato tamaño carta, fuente Verdana tamaño 10 o similar). De acuerdo con el punto 5.5 de las bases que rigen este concurso, no debe incluir en esta sección información que le identifique, tales como: nombres, iniciales, institución de pertenencia o patrocinante, links u otros antecedentes. Las citas a trabajos propios (autocitas) o trabajos previos se deben realizar de forma neutra, es decir, que no permita identificar al/a la postulante. PROTECCIÓN AMBIENTAL, CONSERVACIÓN y PRESERVACIÓN DE RECURSOS NATURALES RENOVABLES: ANÁLISIS JURISPRUDENCIAL Y NORMATIVO Los conceptos de protección del ambiente, conservación del patrimonio ambiental y preservación de la naturaleza utilizados por la normativa constitucional y legal chilena, son diferentes no sólo en su significado, sino también en sus objetivos. Basado en lo anterior, se postula que una de las consecuencias de esas diferencias es el grado de intervención que cada uno de ellos implica, exige o permite a través de la acción de la autoridad respecto del uso, aprovechamiento o gestión de recursos naturales o elementos del ambiente que pueden realizar las personas, como destinatarias de la regulación ambiental. Y que deberían usarse, en la legislación, la acción administrativa y la jurisprudencia, con mayor precisión y cuidado sobretodo al usarlo como fundamento o motivación de actos de autoridad. El presente proyecto se propone avanzar en determinar si la diferencia conceptual que las definiciones legales reconocen es utilizada por la jurisprudencia de la Corte Suprema, como tribunal supremo al fallar los recursos de protección ambiental, por los Tribunales Ambientales, como órganos jurisdiccionales especializados en la materia, que deben resolver conflictos jurídicos sobre la aplicación de instrumentos de gestión ambiental específicos, y por la Contraloría General de la República al interpretar administrativamente la aplicación de ellos dentro de su facultades. Para esto se analizará la jurisprudencia de cada organismo sobre estos tópicos entre los años 2012 a 2022. Adicionalmente, el proyecto busca realizar una tarea de aclaración de la dogmática nacional, dilucidando la utilización de estos términos para la creación, aplicación y evaluación de instrumentos de gestión ambiental sobre recursos naturales. Finalmente, se propone relevar la utilización de estos conceptos en la legislación ambiental (LGBMA, regulación de áreas y especies protegidas, instrumentos contenidos en la nueva normativa sobre Cambio Climático, entre otras) y en la legislación sectorial de recursos naturales renovables (aguas, pesca y acuicultura, bosques, suelos). La hipótesis de trabajo plantea que la regulación de instrumentos de gestión sobre recursos naturales renovables considera la distinción entre objetivos de protección, conservación y/o preservación ambiental, la que no ha sido debidamente acogida por la jurisprudencia judicial y administrativa nacional, considerando que la utilidad de distinguir entre ellas afecta la exigibilidad de medidas más o menos restrictivas respecto del aprovechamiento y resguardo de este tipo de elementos naturales según la causal que se invoque en su fundamentación. La metodología a utilizar se enfocará en analizar en ...",Derecho de los Recursos Naturales
11231110_Resumen_Abstract.pdf,"mas no se hayan adecuado a los importantes cambios sociales que el país ha ido sufriendo o, lo hayan hecho imperfectamente, ni presenten, en general, las características propias de igualdad y universalidad de un sistema de seguridad social, tal como éste se ha articulado en el Derecho comparado. El objetivo general del proyecto es: “Describir, analizar y demostrar, a través de un estudio dogmático y jurisprudencial, los problemas jurídicos que surgen como consecuencia de la protección de los independientes o autónomos en el régimen de Seguridad Social chileno, con el propósito de demostrar su insuficiencia y proponer un modelo adecuado de regulación de los autónomos, que se admita en una efectiva protección social”. Los objetivos específicos, son los siguientes: a) Describir, categorizar y discriminar dogmáticamente los distintos tipos de terceros independientes o autónomos, para establecer y organizar un marco teórico imprescindible de análisis de la situación de los terceros frente al régimen de Seguridad Social chileno; b) Examinar la regulación contributiva y no contributiva que protegen a los autónomos en el régimen de Seguridad Social chileno, para destacar las insuficiencias del régimen y la falta de cobertura de todos los casos de autónomos; c) Examinar la regulación contributiva y no contributiva que protegen a los autónomos en el derecho comparado, para destacar las insuficiencias del régimen y la falta de cobertura de todos los casos de autónomos; d) Examinar los ámbitos de protección que el trabajador autónomo debe recibir para afirmar la existencia de un Sistema de Seguridad Social en Chile, para proponer un modelo adecuado de regulación de los autónomos, que admita una efectiva protección del Régimen de Seguridad Social en Chile. El primer año se avanzará del siguiente modo: a) La reunión y estudio del material bibliográfico que permita articular una explicación sistemática sobre la evolución histórica y, en consecuencia, la caracterización dogmática de los trabajadores autónomos o independientes; b) Revisión del material bibliográfico que permita la descripción del régimen protector en Chile y en derecho comparado, en el caso de los autónomos; c) Análisis de las figuras propias de los trabajadores autónomos y su protección en el régimen; d) Preparación artículo indexado; e) Participación en Jornadas Nacionales de Derecho del Trabajo o Congreso equivalente. Para el segundo año se prevé la consecución de los objetivos 3 y 4, en las siguientes etapas: a) Envío de artículo indexado; b) Preparación de capítulo de libro asociados a los objetivos del proyecto; c) participación en Jornadas Nacionales de Derecho del Trabajo o Congreso equivalente; d) Organización de Congreso asociado al proyecto. Concurso de Proyectos de Iniciación en Investigación 2023",Derecho del Trabajo y la Seguridad Social
11231118_Resumen_Abstract.pdf,"n, siendo necesario revisar la noción jurídica de jornada de trabajo, en especial, los criterios de delimitación, así como los instrumentos jurídicos destinados a dar efectividad al derecho al descanso, a fin de establecer nuevos equilibrios entre los intereses de los trabajadores y empleadores. El objetivo general del proyecto es analizar, desde un punto de vista jurídico, los desafíos que impone la era digital en la delimitación del tiempo de trabajo, a fin de diferenciarlo del tiempo de no trabajo o descanso, en un contexto en el que las fronteras entre vida laboral y personal/familiar se diluyen por la hiperconectividad facilitada por las TIC. Junto con ello, se busca ofrecer una propuesta que contribuya a diseñar instrumentos jurídicos que permitan delimitar de forma efectiva las horas de trabajo a fin de que los trabajadores gocen de un tiempo de descanso real. Para dicho objetivo se realizará, primeramente, un análisis de lege lata, a fin de determinar si el marco normativo general sobre jornada y descansos permite resolver los problemas derivados del uso de las TIC en la delimitación de los tiempos de trabajo y descansos. Posteriormente, se realizarán propuestas de lege ferenda sobre los instrumentos jurídicos para garantizar el derecho al descanso. Se utilizará la metodología propia de las ciencias jurídicas, reuniendo doctrina, jurisprudencia administrativa y jurisprudencia judicial, textos normativos, historia legislativa, tanto nacional como comparada, relativa al tema de investigación. Luego, se realizará su estudio crítico y sistematización para alcanzar los objetivos propuestos y corroborar la hipótesis planteada, originando los productos comprometidos. Junto con ello, se analizarán estudios empíricos sobre el impacto de las TIC en la organización de los tiempos de trabajo y descansos, tanto de organismos públicos como privados, por ejemplo, la última Encuesta Laboral de la Dirección del Trabajo, y se organizarán entrevistas con dirigentes sindicales y empresariales para obtener sus impresiones sobre el tema. Asimismo, se solicitará vía transparencia, el detalle de denuncias administrativas y sus resultados en torno a la lesión del derecho al descanso. El resultado que se espera es la elaboración de un marco teórico idóneo que desarrolle el problema de las TIC y tiempo de trabajo, dando cuenta de los retos o desafíos que la transformación digital impone al derecho del trabajo. Junto con ello, se espera entregar los lineamientos para una reconfiguración de la noción de jornada de trabajo, así como una propuesta de regulación de los instrumentos o herramientas jurídicas que se deben implementar para garantizar la efectividad del derecho al descanso, que pueda ser utilizado por el legislador. Se ofrecen como productos dos artículos indexados y la realización de dos seminarios académicos y reuniones de intercambio científico. Concurso de Proyectos de Iniciación en Investigación 2023",Derecho del Trabajo y la Seguridad Social
11231233_Resumen_Abstract.pdf,"Contenido: Tensiones y desafíos del derecho y la regulación ambiental en el contexto de la transición ecológica La crisis climática y ecológica impone desafíos tanto a escala global como a escala local, para reducir sus daños y adaptarnos, cuestión que resulta en la idea de transición ecológica y que implica modificaciones en diversas estructuras sociales, entre ellas el derecho. La transición ecológica, por su parte, supone que nos encontramos frente a una reconfiguración profunda del funcionamiento de un sistema u organización y en el caso específico de la transición ecológica, una modificación estructural de la tecnología, la economía, las instituciones y la cultura. Esto incluye modificaciones en el derecho. La complejidad y profundidad de las modificaciones de las estructuras internas del derecho, y particularmente del derecho ambiental, significan una serie de tensiones que se manifestarán tanto en a nivel internacional como en los ordenamientos jurídicos nacionales, cuestión que podría significar un problema para el logro de los objetivos públicos de la transición ecológica. Dichas tensiones quedarán de manifiesto en la selección de herramientas y estrategias regulatorias para lograr la transición ecológica, entendido que estas herramientas buscarán modificar el comportamiento de los sujetos en línea con una idea de intervenciones públicas que no se circunscriben al derecho, sino que lo consideran como una de las posibilidades de regulación. El derecho presenta tensiones al momento del cambio, sobre todo cuando este cambio es de la profundidad que requiere la transición ecológica, haciéndose necesario estudiar las maneras en que dichas tensiones pueden superarse y cuales son los cambios estructurales del derecho, y particularmente del derecho ambiental, para propiciar el logro de los objetivos de la transición ecológica. Este proyecto se propone investigar las herramientas regulatorias e innovaciones jurídicas que se han propuesto en el nivel internacional, así como aquellas que encontrándose en los ordenamientos nacionales, han tenido una mayor difusión entre los países con sistema de derecho continental. Luego, pretende observar aquellas que se han aplicado o se discute su aplicación el Chile, identificando en todos los casos las tensiones que se han producido. Por último, el presente proyecto pretende analizar las estructuras internas del derecho ambiental chileno, de modo de identificar preventivamente cuales serían las áreas en que se requiere una flexibilización, para efectos de propiciar las intervenciones públicas propias de la transición ecológica.",Derecho de los Recursos Naturales
1230049_Resumen_Abstract.pdf,"Contenido: RESUMEN: Nombre Inv. Responsable: Título Proyecto: Johann Sebastian Benfeld Escobar Hechos institucionales y valoración de la prueba judicial conforme a la sana crítica La sana crítica puede ser entendida como un elaborado proceso de razonamiento y argumentación que permite al órgano decisor realizar, en la fase de ponderación de la prueba judicial, el tránsito desde un hecho bruto hasta el caso supuesto por la norma jurídica, mediante la subordinación de recursos epistémicos a criterios normativos dentro de un proceso judicial. La anterior afirmación se justifica por la dimensión institucional que adquieren los hechos en el derecho, incluso en la fase de ponderación de la prueba. En tal sentido, el principal objetivo de la presente investigación es exponer las consecuencias teóricas y prácticas que tiene para una teoría de la valoración de la prueba judicial el reconocimiento de la dimensión institucional de los hechos con ocasión de su prueba y valoración. Con este objetivo en mente, esta investigación intenta (i) precisar el concepto de hecho institucional y su importancia para la comprensión de la verificación del supuesto jurídico; (ii) determinar en qué medida la dimensión institucional de los hechos a ser probados explica las dificultades para distinguir con precisión entre las cuestiones de derecho y de hecho en la fase de ponderación de la prueba; (iii) demostrar que la dimensión institucional de los hechos en el contexto de la prueba judicial exige una mejor articulación entre las actividades de interpretación, subsunción y calificación jurídica de los hechos en un proceso judicial, y, finalmente (iv) mostrar, por todo lo anterior, los inconvenientes que presentan las estrategias meramente epistemológicas a la hora de explicar el fenómeno de la valoración de la prueba judicial. Para exponer las consecuencias teóricas y prácticas que tiene para una teoría de la valoración de la prueba judicial el reconocimiento de la dimensión institucional de los hechos con ocasión de su prueba y valoración, cuestión normativamente reconocida en nuestro sistema en los artículos 456 Código del Trabajo, 132 del Código Tributario y 14 de la Ley 18.287, se utilizará diversos métodos de indagación: el analítico filosófico; el histórico exegético y el dogmático jurídico; mostrando cómo la dimensión institucional de los hechos en el derecho encuentran su correlato normativo no solo en los artículos señalados, sino que de hecho es la que mejor da cuenta del régimen de ponderación conforme a la sana crítica. El estudio filosófico, histórico y dogmático de los materiales doctrinales y jurídicos permitirá́ así evaluar, también, algunas prácticas jurisprudenciales que, en un viaje de ida y vuelta, en algunos casos influyen en el trabajo de los autores y en otros son influidas por la teoría, entre ellas, la calificación judicial de la pertinencia del hecho a probar, la identificación de un hecho nuevo y el control de las Cortes de los puntos de prueba a través de los recursos de apelación, nulidad y casación. Finalmente, desde una perspectiva más general, esta investigación explora una línea teórica en parte descuidada hasta el momento en el medio ...",Derecho Procesal
1230052_Resumen_Abstract.pdf,"Contenido: RESUMEN: Nombre Inv. Responsable: EL PLAN REGIONAL DE ORDENAMIENTO TERRITORIAL COMO INSTRUMENTO DE GOBERNANZA CLIMÁTICA TERRITORIAL MULTINIVEL. Título Proyecto: Benoît Delooz Brochet Describa los principales temas que se abordarán en el proyecto: objetivos, metodología y resultados esperados. La extensión máxima de esta sección es de 1 página (utilizar formato tamaño carta, fuente Verdana tamaño 10 o similar). El proyecto de investigación tiene como objeto de estudio el Plan Regional de Ordenamiento Territorial (PROT), de reciente introducción en Chile, entendido a la vez como un instrumento de planificación clave para la regionalización de la Administración del Estado y como un instrumento de gobernanza climática territorial multinivel. Con el PROT el legislador busca descentralizar del gobierno central a las regiones competencias de planificación administrativo-territorial relevantes para el desarrollo sustentable. Ahora bien, nos encontramos ante un marco normativo que plantea numerosos interrogantes pues deberá incorporar la “variable climática” introducida por el derecho internacional y la reciéntemente publicada el 13 de junio Ley Marco de Cambio Climático. El PROT representa por tanto una respuesta a las demandas de la sociedad y de la comunidad internacional cuya satisfacción determinará la legitimidad de las instituciones en los próximos años. Con todo, este instrumento de planificación y ordenamiento territorial cuenta con una trayectoria dilatada en países como España y Francia que, dada su cercanía al derecho admirativo chileno, y sus modelos de Estado regional y Estado unitario respectivamente, justifican la perspectiva comparada del presente proyecto. Todo lo anterior justifica la realización de una investigación sobre un objeto que por su novedad no ha sido estudiado en Chile. La relevancia del proyecto consiste por tanto contribuir a colmar el vacío en la literatura sobre tema de relevancia a la vez nacional (descentralización) e internacional (cambio climático) mediante una investigación cuya originalidad reside en su perspectiva multinivel, comparada y prospectiva. Para ello, los objetivos específicos dicen relación con: 1) analizar la normativa relativa a la elaboración, aprobación y ejecución del PROT chileno y sus equivalentes español y francés, así como los respectivos procedimientos de evaluación ambiental de los instrumentos de ordenación del territorio, para identificar las fallas eventuales de la normativa chilena en la materia; 2) determinar el grado de introducción efectiva de la variable climática en las fases de elaboración, aprobación y ejecución del PROT y en los procedimientos de evaluación ambiental estratégica de éstos; 3) realizar estudios de casos, exitosos y /o problemáticos, de aparición y resolución de conflictos entre los entes territoriales (ET), y entre los ET y el Estado central, en torno a la elaboración, aprobación y ejecución de los instrumentos de ordenación del territorio y cambio climático español y francés con especial relevancia para Chile; y 4) proponer mejoras en la definición y el ejercicio de competencias descentralizadas en materia de lucha contra el cambio climático y en pro del desarrollo sustentable en general. Para lograrlos, la metología utilizada será a la vez dogmat́ ica y empírica para analizar fuentes compuestas de políticas, normativas, planes, jurisprudencia, nacionales y extranjeras, entre otras. Se prestará ...",Derecho de los Recursos Naturales
