filename,relevant_text_segment,assigned_subject
11201297_Resumen_Abstract.pdf,"Contenido: RESUMEN: Describa los principales puntos que se abordarán en la propuesta: objetivos, metodología y resultados esperados. La extensión máxima de esta sección es de 1 página tamaño carta (utilizar formato tamaño carta, fuente Verdana tamaño 10 o similar). Evite incluir en esta sección información que le identifique, tales como: nombres, iniciales, institución de pertenencia o patrocinante, links u otros antecedentes. La investigación que se propone versa acerca de uno de los presupuestos del Estado social, esto es, la “procura existencial” (Daseinsvorsorge en su originaria denominación alemana), como categoría teleológica que rige la acción pública desplegada a través de la Administración del Estado, y que alude a las prestaciones de servicio y producción de bienes de relevancia vital para los individuos. Esta categoría dogmática del Derecho administrativo, que es un elemento clave del Estado social, es aplicable, asimismo, como principio rector en la regulación de ciertos ámbitos de referencia en los cuales existe un interés público, y en especial, cuando en virtud de la privatización de las actividades originalmente de procura existencial, estas han dejado de ser llevadas a cabo directamente por el Estado. Los objetivos generales de la investigación son los siguientes: (i) proporcionar una comprensión dogmática de la categoría jurídica “procura existencial”, como un elemento de un Estado que persigue fines sociales, paradigmáticamente, del Estado social de Derecho, delineando sus características teóricas y prácticas; y (ii) inducir y generar un modelo —una matriz— de procura existencial, cuyo medio de origen es una economía indudablemente capitalista e industrializada como la alemana, para presentarlo como una elaboración idónea que justifica la intervención estatal en ciertas áreas, traduciéndola al Derecho chileno, formulando aplicaciones concretas en algunos ámbitos de referencia, como los de la vivienda, agua potable y el transporte. En cuanto a los objetivos específicos de la investigación, estos consisten en: (a) Introducir la categoría “procura existencial” en el Derecho Público chileno, considerando el escenario actual en que está en discusión el modelo de Estado subsidiario vigente; (b) sistematizar de la teoría de la procura existencial que opere en distintos niveles y ámbitos de actividad, identificando los instrumentos con los cuales opera; (c) demostrar que la procura existencial es un dispositivo útil para justificar una intensa intervención estatal en varias áreas, como la vivienda, producción de agua potable y transportes; y (d) operativizar la categoría de la Daseinsvorsorge en el Derecho público chileno, mostrando los diversos ajustes que en ciertos sectores deben llevarse a cabo sobre su base, en lo que pueden ser propuestas de lege ferenda. Como resultado de la investigación, se pretende comprobar las siguientes tres hipótesis: (1) La procura existencial es un dispositivo jurídico que permite determinar cuándo en una determinada actividad o producción de bienes ha de considerarse el interés común como limite a la iniciativa económica, en un sentido tal que dicha actividad o producción deban excluirse de la dinámica del mercado, siendo procedente su prestación o producción directamente por la Administración, o a través de terceros intensamente controlados administrativamente; (2) La procura existencial es un ...",Filosofía del Derecho
11201308_Resumen_Abstract.pdf,"n esta sección información que le identifique, tales como: nombres, iniciales, institución de pertenencia o patrocinante, links u otros antecedentes. Proyecto: “El Dolo en el Derecho penal: concepto y límites”. Presentación: El punto de partida de este proyecto de investigación es el siguiente dato objetivo: la constatación de la existencia de un cuestionamiento constante en diversos sistemas jurídicos, tanto a nivel doctrinal como jurisprudencial, sobre el concepto y límites del dolo. El problema jurídico que se plantea es el siguiente: La ausencia de determinación del contenido y límites precisos del dolo en el Derecho Penal sustantivo puede causar serios problemas al momento de determinar la responsabilidad penal en el plano procesal. Por el contrario, un Derecho penal racional y coherentemente fundamentado debe considerar que la pena es el resultado de la intensidad del compromiso personal con la contravención de normas de comportamiento. Objetivos. Objetivo general. El objetivo general de este proyecto es profundizar el estudio del dolo y sus límites, incluyendo una perspectiva dogmática propia de la ciencia penal, con énfasis en la determinación de modelos de imputación coherentes con las hipótesis apuntadas, que puedan servir para su implementación por la praxis jurisprudencial de nuestro contexto jurídico-cultural. Objetivos específicos. Los objetivos específicos vinculados al objetivo general son los siguientes: 1.- Realizar una caracterización de los criterios doctrinales que sirven para la distinción del dolo y la imprudencia, tanto en los modelos apuntados como en el sistema chileno. 2.- Evaluar la eficacia de los modelos adoptados en el Derecho Penal alemán, español e italiano para la valoración de experiencia jurídica chilena. 3.- Llevar a cabo un análisis jurisprudencial crítico que permita evaluar las tendencias actuales y los criterios que sirven para probar el dolo (paradigmas de imputación y prueba inferencial). 4.- Definir estrategias de actuación (lege lata) para una construcción la imputación subjetiva a título de dolo que aspire a ofrecer: (a) una distinción clara con la imprudencia, lo que conlleva su necesaria conceptualización y fundamento normativo, teniendo en cuenta los paradigmas actuales (tendencias del derecho penal continental); (b) reglas que sirvan para la atribución de responsabilidad penal a título de dolo, como criterios uniformes valorativos que consideren el estado actual de la teoría de la imputación subjetiva; (c) proponer nuevas soluciones de derecho positivo en especial en las cuestiones interpretativas que se siguen planteando en el debate científico actual. 5.- Someter a la comunidad jurídica nacional e internacional las soluciones dogmáticas propuestas en relación con el dolo y sus opciones interpretativas. Metodología. La metodología de investigación comprenderá: (1) El método hermenéutico: análisis de la regulación positiva vigente en relación con el dolo y sus opciones interpretativas. (2) El método dogmático: análisis y sistematización documental sobre el fundamento filosófico y normativo del dolo y la imprudencia, doctrina, evolución histórica y jurisprudencial para la construcción de límites. (3) Exploración documental jurisprudencial: evaluar la relevancia de los planteamientos jurisprudenciales, sus significados, implicaciones y límites en el ámbito continental estudiando los casos límites entre dolo e imprudencia. (4) Método comparativo: estudio y evaluación de ...",Derecho Penal
11201330_Resumen_Abstract.pdf,"Contenido: RESUMEN PROYECTO LAS ADOLESCENTES PRIVADAS DE LIBERTAD EN CHILE, GÉNERO Y DERECHOS HUMANOS: BASES PARA LA MEJORA DE UNA POLÍTICA SECTORIAL Objetivo general: analizar si el tratamiento penitenciario que las adolescentes privadas de libertad en régimen cerrado reciben en el actual sistema de responsabilidad penal adolescente (LRPA) incorpora la perspectiva de género y los estándares internacionales de derechos humanos. Tomando este marco de referencia se analizará la situación de las adolescentes que están privadas de libertad en régimen cerrado, con el objeto de examinar, críticamente, las falencias normativas y prácticas que se identificen en la ejecución de la privación de libertad, para proponer mejoras en la política penitenciaria vigente. Objetivos específicos: 1.- Analizar el tratamiento penitenciario que las adolescentes privadas de libertad en régimen cerrado reciben en el actual sistema de responsabilidad penal adolescente. Para ello, se revisará la información levantada por las CISC, la legislación, políticas y programas existentes en la materia. 2.-Analizar si la normativa, políticas y programas nacionales incorporan la perspectiva de género y los estándares internacionales de derechos humanos. Asimismo, se analizarán estudios internacionales que permitan hacer un análisis comparado. 3.-Analizar las apreciaciones que tienen los actores involucrados en el Sistema de Responsabilidad Penal Adolesente (educadoras de trato directo en régimen cerrado, directores/jefaturas técnicas en los centros de régimen cerrado, encargados/as de programas de régimen cerrado, jueces, fiscales y defensores). 4.- Analizar las apreciaciones que tienen las adolesentes privadas de libertad en régimen cerrado a nivel nacional sobre su experiencia en el Sistema de Responsabilidad Penal Adolesente en lo referente a presencia de estereotipos, derecho a la salud, derechos sexuales y reproductivos y maternidad. 5.- Analizar los problemas que se identifican en el sitema penitenciario respecto de ellas. 6.- Analizar buenas prácticas internacionales de tratamiento penitenciario de adolescentes privadas de liebrtad con el objeto de estudiar su replicabilidad en Chile y su incorporación en las propuestas de mejora. 7.- Proponer mejoras en la política penitenciaria vigente, según los hallazgos del estudio. Metodología -El presente estudio hará una exhaustiva revisión documental, de la legislación vigente y la bibliografía más relevante y actualizada que tenga relación con el problema de investigación. -Se propone producir información cualitativa a partir de la técnica de las entrevistas semi–estructuradas a distintos actores del sistema de justicia juvenil, y de la técnica de las entrevistas en profundidad a adolescentes que estén cumpliendo sanción en régimen cerrado en el marco de la Ley N°20.084. -Asimismo se analizarán buenas prácticas internacionales para lo cual se revisarán documentos y normativas de los países seleccionados y se realizarán breves estancias de investigación. Resultados Esperados Como se ha señalado, el presente estudio analizará la situación de las adolescentes que están privadas de libertad en régimen cerrado, con el objeto de examinar, críticamente, las falencias normativas y prácticas que se identificen en la ejecución de la privación de libertad, para proponer mejoras en la política penitenciaria vigente. Por tanto se trata de un estudio relevante que busca impactar en el diseño y ejecución de una política penitenciaria para ...",Derecho Penal
1200060.pdf,"Contenido: PROPOSAL ABSTRACT: Name of Principal Investigator: Proposal Title: GABRIEL L. NEGRETTO CONSTITUTIONAL CHANGE AND LIBERAL DEMOCRACY IN COMPARATIVE PERSPECTIVE Describe the main issues to be addressed: goals, methodology and expected results. The maximum length for this section is 1 page (Must use letter size, Verdana size 10 or similar). Do the political origins of constitutions matter for the establishment and deepening of democracy? A long- standing hypothesis in comparative political science has traced the emergence of a self-enforcing democracy back to an agreement among political elites that succeeds in creating and implementing a constitution that limits the stakes of power during competitive elections. Many philosophers and constitutional theorists, in turn, have argued that the active involvement of ordinary citizens during foundational constitutional moments creates a heightened sense of collective ownership over the new text, promotes a democratic institutional design, and facilitates its enforcement. Neither claim, however, has been rigorously examined in theoretical and empirical terms. History records both failures and democratic successes with constitutions of elitist or popular origins and of widely different designs. This project fills this void by analyzing, from an interdisciplinary and comparative perspective, the institutional and political effects of processes of constitutional change on the establishment and consolidation of liberal democracy. Most existing works on the impact of constitutional origins on democratization are either purely analytic or based on a single case or a restricted sample of cases (see Bonime-Blanc 1986; Weingast 2004; Özbudun and Gençkaya 2009; Mittal and Weingast 2013). The few comparative studies available on this topic focus on particular conditions of constitutional creation but do not explore the full range of variation in the influence of elites and citizens on constitution making and the effects that this variation might have on institutional selection and democratic performance (see Wheatley and Germann 2013; Eisenstadt, LeVan, and Maboudi 2017; Albertus and Menaldo 2018; Negretto 2019). In contrast, this project will provide a comprehensive comparative analysis of the relationship between the political origins of constitutions, their content, and the effective implementation of institutional constraints on executive power and citizen rights in the short and medium term after enactment of the respective constitution. My leading hypothesis is that although direct popular participation during constitution writing may provide reformers with incentives to adopt formal democratic reforms, institutional constraints on executive power and citizen rights because most elite agreements tend to be opportunistic, I expect the democratizing global dataset on comparisons where different initial conditions led to similar outcomes. Nevertheless, using an original are most likely to be strengthened and effectively implemented when new constitutions are adopted through cooperation among representatives of a plurality of political forces. of constitution making to be larger during the early years of life of the new constitution, when the balance of power among the political forces that created the constitution tends to remain stable. I will use mixed methods to refine and test these hypotheses. I will start with a large-N statistical analysis effects of this modality the origins of constitutions adopted or ...",Sin clasificación
1200064.pdf,"daño moral, ha sido relevante para los nuevos desarrollos de estas disciplinas. Para el análisis se utilizará el marco teórico de la dignidad como estatus elaborado por Jeremy Waldron, por ser una concepción contemporánea y que enfatiza una perspectiva más jurídica que filosófica en esta temática. Objetivo general: Estudiar la relevancia de la noción de dignidad en el derecho privado chileno, con el fin de dilucidar sus influencias y de esta forma visibilizar su relevancia simbólica en desarrollos jurídicos importantes del derecho privado actual y futuro. Objetivos específicos: 1) Analizar la vinculación de la dignidad con las evoluciones más recientes del derecho privado chileno, tanto civil como laboral, considerando la dignidad como estatus y el efecto simbólico de la misma. 2) Visibilizar la relevancia del aspecto simbólico de la dignidad en desarrollos jurídicos importantes del derecho privado actual y futuro, teniendo en cuenta especialmente sus implicancias para el desarrollo del concepto de daño moral en el ámbito civil y laboral. 3) Analizar las principales implicancias que tiene para el derecho privado, específicamente el derecho civil y el derecho laboral, la protección de la dignidad humana en sentido igualitario. Metodología: Para cumplir con el primer objetivo específico, se procederá́ principalmente en base al método analítico, mediante el cual se estudiará la evolución de la noción de dignidad y su influencia en el derecho privado. Del estudio de la relación de dichos elementos se pretende alcanzar los objetivos trazados y la comprobación de nuestra hipótesis. Para cumplir con los objetivos específicos 2 y 3, se empleará la metodología propia de la disciplina jurídica, esto es, análisis de doctrina, legislación y jurisprudencia. En cuanto a la doctrina, se tendrá en cuenta doctrina extranjera, principalmente aunque no exclusivamente del common law, donde el concepto igualitario de dignidad humana ha tenido un mayor desarrollo. En cuanto a la legislación, se analizará especialmente la legislación chilena y sus enmiendas recientes, pero considerando también algunas legislaciones extranjeras, sobre todo en relación a la incorporación de la dignidad humana como un valor protegido por el derecho privado. En cuanto al análisis de jurisprudencia, se discutirá la relativa al daño moral de la Corte Suprema chilena durante los últimos años. El criterio delimitador para la selección de casos a analizar será el de identificar aquellos en los cuales se decreta la indemnización del daño moral para remediar la comisión de ilícitos particularmente graves, ya sea por la conducta reprochable del demandado o por lo significativo de los valores que fueron vulnerados a la víctima. En materia laboral serán analizadas las sentencias del procedimiento de tutela de derechos fundamentales (ley No 20.087). Resultados esperados: (1) Publicación de al menos tres artículos o capítulo de libro en coautoría (uno por cada año de ejecución del proyecto), de los cuales a lo menos dos serán publicados en revistas académicas indexadas en WoS, scopus o scielo. (2) Presentación de los resultados de la investigación en a lo menos dos seminarios o conferencias. (3) Organización de un seminario internacional en la Universidad Adolfo Ibáñez, ...",Derecho del Trabajo y la Seguridad Social
1200069.pdf,"te del derecho al debido proceso, sino que con seria afectación de la interdicción del desborde de las atribuciones de este sentenciador solitario en el sentido que marcan los límites que imponen el respeto a las llamadas reglas de la sana crítica y el deber de fundamentación de los fallos. Nuestro objetivo general será: Revisar críticamente los criterios interpretativos que se han instalado en las Cortes de Apelaciones al momento de conocer y fallar respecto de los recursos de nulidad laboral y, a partir de allí, proponer una fórmula general y lecturas interpretativas específicas que permitan superar la práctica judicial actual que ha terminado desfigurando o haciendo en buena medida ilusorio el deber de motivación y el derecho al recurso en el orden jurisdiccional laboral. Al hilo de lo anterior, los específicos serán: - Determinar el contenido que debe tener el derecho al recurso, en cuanto garantía, en materia laboral, en aras a lograr un mejor funcionamiento y calidad de la justicia que se imparte. - Identificar los principales nudos interpretativos que en la actualidad formalizan y restringen la revisión posible a través del recurso de nulidad laboral. - Explicar la forma en que esta fórmula restrictiva y formalista ha influido en establecer al juez del juicio laboral como “soberano” en materia de valoración probatoria y en la forma en que fundamentan sus sentencias para lograr inmunizarlos, legítimamente, del control superior. - Establecer las condiciones necesarias para estar efectivamente frente a una valoración probatoria existente y suficiente, además de coherente en su motivación. - Ofrecer, allí donde no sea suficiente el esfuerzo re-interpretativo, propuestas de reforma legal específicas que permitan asegurar que el instrumento recursivo efectivamente cumpla el estándar que debe reconocerse al derecho al recurso como integrante del derecho al debido proceso. La metodología a emplear será la usual para las ciencias jurídicas. Se aplicarán los métodos analítico, documental y comparativo. En primer lugar, se realizará un tratamiento analítico-teórico y jurisprudencial que permita la correcta delimitación de la institución del recurso de nulidad y sus imbricaciones con el derecho al recurso, en el ámbito laboral. Para cumplir cabalmente con esta finalidad se llevará a cabo una profunda revisión de las fuentes bibliográficas así como de sentencias paradigmáticas de las Cortes de Apelaciones conjugando un análisis técnico-normativo con su plano de aplicación. En específico, se utilizará una muestra probabilística (aleatoria) de la jurisprudencia laboral de cuatro años (2017, 2018, 2019 y 2020) - de tribunales laborales especializados y tribunales no especializados y Cortes de Apelaciones medianas y grandes - que junto con permitir demostrar empíricamente que los tribunales laborales están dando una aplicación contraria a los estándares de fundamentación de los fallos y del derecho al recurso, permita generalizar los resultados de la investigación al resto de la población (sentencias). Adicionalmente, se realizará un análisis desde la óptica del derecho comparado y, de este modo, se procederá al completo estudio dogmático (de lege data y de lege ferenda) que permita exponer los resultados científicos más relevantes. Finalmente, se efectuará una ...",Derecho Procesal
1200083.pdf,"Contenido: RESUMEN: Nombre Inv. Responsable: Título Proyecto: Raúl Carnevali Rodríguez Justicia restaurativa y sistema penal. Hacia un modelo de solución de conflictos Describa los principales puntos que se abordarán: objetivos, metodología y resultados esperados. La extensión máxima de esta sección es de 1 página tamaño carta (utilizar formato tamaño carta, fuente Verdana tamaño 10 o similar). Desde la década de los setenta se vienen desarrollando con especial intensidad los llamados mecanismos alternativos de solución de conflictos en materia penal. Desde la primera práctica restaurativa —Canadá en 1975— comenzó a extenderse hacia otros países, sobre todo respecto de delitos cometidos por jóvenes. Actualmente, es posible encontrar diversos instrumentos internacionales, ya sea de las Naciones Unidas, Consejo de Europa o de la Unión Europea que apoyan la incorporación de estos mecanismos dentro del sistema penal. Las razones son múltiples, pero se pueden centrar en cuatro: a) la necesidad de descongestionar el sistema de corte retributivo, que no puede responder adecuadamente a la demanda ciudadana; b) vinculado con lo anterior, ello ha dado lugar a manifestaciones de desconfianza, sobre todo, por la insuficiente respuesta que se observa respecto a la víctima, en especial frente a su reparación; c) los cuestionamientos a las penas, particularmente a las privativas de libertad, y d) el que tenga un carácter autocompositivo, fortalecería la confianza en el sistema de administración de justicia, además de incentivar la búsqueda de soluciones pacíficas, construidas sobre la base del diálogo. Fundamentalmente se entiende por justicia restaurativa como aquel proceso participativo y deliberativo, en que el autor y la víctima, fundamentalmente, procuran a través de encuentros llegar a acuerdos satisfactorios que permita reparar los daños causados por el hecho delictivo, prestándose especial atención a la víctima. Así también, el que la solución no se centre en la imposición de una pena, no debe entenderse como una carencia de asunción de responsabilidad por parte del autor. Todo lo contrario, uno de los propósitos de estos mecanismos es su responsabilización, entendida esencialmente como reconocimiento del daño y de qué forma procurar su reparación. Precisamente, en este contexto es que uno de los objetivos que se persiguen en el proyecto es determinar cómo las . Así como propender a la consecución de objetivos propios de tales mecanismos y que podrían escapan a lo que puede esperarse de la pena. Ciertamente no se pretende que estos instrumentos reemplacen al sistema penal de corte retributivo, pero ello no es óbice para la implementación de mecanismos de solución complementarios. En este sentido, podría discutirse su aplicación en cualquier etapa del procedimiento, incluso durante la ejecución de la pena. De un estudio de esta naturaleza se espera precisar de qué forma estos mecanismos alternativos brindan respuestas satisfactorias a la solución de conflictos penales. Para tal efecto, se debe analizar: a) si uno de los ejes centrales es la reparación a la víctima, determinar de qué forma se puede lograr; b) si la solución del conflicto no supone la imposición de un castigo, qué se requiere para estimar estos mecanismos como ...",Derecho Penal
